{"datasetPath":"2026-10/dataset.json","datasetSha256":"B2EDDE2044305C7F2FD43DD97B797ECDDB4E03F4BADE3AD99B538844533AEEE0","manifestPath":"2026-10/manifest.json","periodo":"2026-10","pubblicatoUtc":"2026-10-07T18:54:09.652Z","reportPath":"2026-10/report.md","schemaVersion":"VINCOLI_LATEST_V1","statoDataset":"PARZIALE"}